client_id	path	sentence	up_votes	down_votes	age	gender	accents	locale	segment
b5c9bb77e34f76e3130ba662c4ca78975345e97102b27b4b0fa1c4e4780e078d0487746e577e24531eb5370dd51cb466d469a66dfc378b61001c198fcf9c8756	common_voice_en_31865545.mp3	The circumstances of his death were never explained.	2	0	teens	female	United States English	en	
b5c9bb77e34f76e3130ba662c4ca78975345e97102b27b4b0fa1c4e4780e078d0487746e577e24531eb5370dd51cb466d469a66dfc378b61001c198fcf9c8756	common_voice_en_31865547.mp3	He is imprisoned for debt in the Fleet Prison.	4	0	teens	female	United States English	en	
b5c9bb77e34f76e3130ba662c4ca78975345e97102b27b4b0fa1c4e4780e078d0487746e577e24531eb5370dd51cb466d469a66dfc378b61001c198fcf9c8756	common_voice_en_31865551.mp3	Some organic azides are classified as highly explosive and toxic.	2	0	teens	female	United States English	en	
b5c9bb77e34f76e3130ba662c4ca78975345e97102b27b4b0fa1c4e4780e078d0487746e577e24531eb5370dd51cb466d469a66dfc378b61001c198fcf9c8756	common_voice_en_31865552.mp3	The institute therefore defines itself as being hybrid in nature.	2	0	teens	female	United States English	en	
b5c9bb77e34f76e3130ba662c4ca78975345e97102b27b4b0fa1c4e4780e078d0487746e577e24531eb5370dd51cb466d469a66dfc378b61001c198fcf9c8756	common_voice_en_31865556.mp3	The Carter Center had been created by Jimmy and Rosalyn Carter.	2	0	teens	female	United States English	en	
b5c9bb77e34f76e3130ba662c4ca78975345e97102b27b4b0fa1c4e4780e078d0487746e577e24531eb5370dd51cb466d469a66dfc378b61001c198fcf9c8756	common_voice_en_31865557.mp3	She was reportedly much damaged.	2	0	teens	female	United States English	en	
b5c9bb77e34f76e3130ba662c4ca78975345e97102b27b4b0fa1c4e4780e078d0487746e577e24531eb5370dd51cb466d469a66dfc378b61001c198fcf9c8756	common_voice_en_31865569.mp3	They had their own independent chiefdom before the advent of the Ahoms.	2	0	teens	female	United States English	en	
b5c9bb77e34f76e3130ba662c4ca78975345e97102b27b4b0fa1c4e4780e078d0487746e577e24531eb5370dd51cb466d469a66dfc378b61001c198fcf9c8756	common_voice_en_31865571.mp3	Winter Storm Warnings went into effect for counties in Iowa and northern Illinois.	6	0	teens	female	United States English	en	
b5c9bb77e34f76e3130ba662c4ca78975345e97102b27b4b0fa1c4e4780e078d0487746e577e24531eb5370dd51cb466d469a66dfc378b61001c198fcf9c8756	common_voice_en_31865572.mp3	She lives in Milan.	2	0	teens	female	United States English	en	
b5c9bb77e34f76e3130ba662c4ca78975345e97102b27b4b0fa1c4e4780e078d0487746e577e24531eb5370dd51cb466d469a66dfc378b61001c198fcf9c8756	common_voice_en_31865573.mp3	Diplo and Wallen did not even meet until the making of the music video.	4	0	teens	female	United States English	en	
b5c9bb77e34f76e3130ba662c4ca78975345e97102b27b4b0fa1c4e4780e078d0487746e577e24531eb5370dd51cb466d469a66dfc378b61001c198fcf9c8756	common_voice_en_31865574.mp3	My data told me.	2	0	teens	female	United States English	en	
b5c9bb77e34f76e3130ba662c4ca78975345e97102b27b4b0fa1c4e4780e078d0487746e577e24531eb5370dd51cb466d469a66dfc378b61001c198fcf9c8756	common_voice_en_31865577.mp3	A gallery opens above the porch.	2	0	teens	female	United States English	en	
b5c9bb77e34f76e3130ba662c4ca78975345e97102b27b4b0fa1c4e4780e078d0487746e577e24531eb5370dd51cb466d469a66dfc378b61001c198fcf9c8756	common_voice_en_31865578.mp3	Lander won the election.	4	0	teens	female	United States English	en	
b5c9bb77e34f76e3130ba662c4ca78975345e97102b27b4b0fa1c4e4780e078d0487746e577e24531eb5370dd51cb466d469a66dfc378b61001c198fcf9c8756	common_voice_en_31865581.mp3	Words cannot describe how refreshing it is to see him stand up for himself.	2	0	teens	female	United States English	en	
b5c9bb77e34f76e3130ba662c4ca78975345e97102b27b4b0fa1c4e4780e078d0487746e577e24531eb5370dd51cb466d469a66dfc378b61001c198fcf9c8756	common_voice_en_31865582.mp3	Ainslie graduated from Edinburgh Napier University with an economics degree.	2	0	teens	female	United States English	en	
b5c9bb77e34f76e3130ba662c4ca78975345e97102b27b4b0fa1c4e4780e078d0487746e577e24531eb5370dd51cb466d469a66dfc378b61001c198fcf9c8756	common_voice_en_31865583.mp3	The National Maritime Museum in Greenwich holds examples of her work.	4	2	teens	female	United States English	en	
b5c9bb77e34f76e3130ba662c4ca78975345e97102b27b4b0fa1c4e4780e078d0487746e577e24531eb5370dd51cb466d469a66dfc378b61001c198fcf9c8756	common_voice_en_31865584.mp3	Fassie served as executive producers of the album.	2	0	teens	female	United States English	en	
b5c9bb77e34f76e3130ba662c4ca78975345e97102b27b4b0fa1c4e4780e078d0487746e577e24531eb5370dd51cb466d469a66dfc378b61001c198fcf9c8756	common_voice_en_31865585.mp3	A significant site in the valley contains the remains of an old village.	2	0	teens	female	United States English	en	
b5c9bb77e34f76e3130ba662c4ca78975345e97102b27b4b0fa1c4e4780e078d0487746e577e24531eb5370dd51cb466d469a66dfc378b61001c198fcf9c8756	common_voice_en_31865586.mp3	He left extensive memories of both composers.	2	0	teens	female	United States English	en	
b5c9bb77e34f76e3130ba662c4ca78975345e97102b27b4b0fa1c4e4780e078d0487746e577e24531eb5370dd51cb466d469a66dfc378b61001c198fcf9c8756	common_voice_en_31865590.mp3	Maunder resided in the Greater Los Angeles Area.	4	0	teens	female	United States English	en	
b5c9bb77e34f76e3130ba662c4ca78975345e97102b27b4b0fa1c4e4780e078d0487746e577e24531eb5370dd51cb466d469a66dfc378b61001c198fcf9c8756	common_voice_en_31865594.mp3	This achievement put him in the spotlight in the country.	2	0	teens	female	United States English	en	
b5c9bb77e34f76e3130ba662c4ca78975345e97102b27b4b0fa1c4e4780e078d0487746e577e24531eb5370dd51cb466d469a66dfc378b61001c198fcf9c8756	common_voice_en_31865596.mp3	They fly in May and June.	2	0	teens	female	United States English	en	
b5c9bb77e34f76e3130ba662c4ca78975345e97102b27b4b0fa1c4e4780e078d0487746e577e24531eb5370dd51cb466d469a66dfc378b61001c198fcf9c8756	common_voice_en_31865602.mp3	Will Roshni continue to suffer at the hands of her own grandfather and aunt?	2	0	teens	female	United States English	en	
b5c9bb77e34f76e3130ba662c4ca78975345e97102b27b4b0fa1c4e4780e078d0487746e577e24531eb5370dd51cb466d469a66dfc378b61001c198fcf9c8756	common_voice_en_31865604.mp3	The music video was released on the same day.	2	0	teens	female	United States English	en	
b5c9bb77e34f76e3130ba662c4ca78975345e97102b27b4b0fa1c4e4780e078d0487746e577e24531eb5370dd51cb466d469a66dfc378b61001c198fcf9c8756	common_voice_en_31865609.mp3	Several other courtships take place during the play.	4	0	teens	female	United States English	en	
b5c9bb77e34f76e3130ba662c4ca78975345e97102b27b4b0fa1c4e4780e078d0487746e577e24531eb5370dd51cb466d469a66dfc378b61001c198fcf9c8756	common_voice_en_31865612.mp3	Butler changed his name to Muhammad Abdul Aziz while serving his prison sentence.	2	0	teens	female	United States English	en	
b5c9bb77e34f76e3130ba662c4ca78975345e97102b27b4b0fa1c4e4780e078d0487746e577e24531eb5370dd51cb466d469a66dfc378b61001c198fcf9c8756	common_voice_en_31865614.mp3	That season he also served as the head coach.	2	0	teens	female	United States English	en	
b5c9bb77e34f76e3130ba662c4ca78975345e97102b27b4b0fa1c4e4780e078d0487746e577e24531eb5370dd51cb466d469a66dfc378b61001c198fcf9c8756	common_voice_en_31865615.mp3	Nintendo subsequently received criticism for this decision.	2	0	teens	female	United States English	en	
b5c9bb77e34f76e3130ba662c4ca78975345e97102b27b4b0fa1c4e4780e078d0487746e577e24531eb5370dd51cb466d469a66dfc378b61001c198fcf9c8756	common_voice_en_31865616.mp3	He also wrote his dissertation and conducted some student orchestras.	2	0	teens	female	United States English	en	
b5c9bb77e34f76e3130ba662c4ca78975345e97102b27b4b0fa1c4e4780e078d0487746e577e24531eb5370dd51cb466d469a66dfc378b61001c198fcf9c8756	common_voice_en_31865617.mp3	He was the founder of the National Society for the Abolition of Cruel Sports.	2	0	teens	female	United States English	en	
b5c9bb77e34f76e3130ba662c4ca78975345e97102b27b4b0fa1c4e4780e078d0487746e577e24531eb5370dd51cb466d469a66dfc378b61001c198fcf9c8756	common_voice_en_31865618.mp3	It was the first collaboration between Washington and Quincy Jones.	2	0	teens	female	United States English	en	
b5c9bb77e34f76e3130ba662c4ca78975345e97102b27b4b0fa1c4e4780e078d0487746e577e24531eb5370dd51cb466d469a66dfc378b61001c198fcf9c8756	common_voice_en_31865620.mp3	Schools.	2	0	teens	female	United States English	en	
b5c9bb77e34f76e3130ba662c4ca78975345e97102b27b4b0fa1c4e4780e078d0487746e577e24531eb5370dd51cb466d469a66dfc378b61001c198fcf9c8756	common_voice_en_31865623.mp3	He became the team manager for Fiji.	2	0	teens	female	United States English	en	
b5c9bb77e34f76e3130ba662c4ca78975345e97102b27b4b0fa1c4e4780e078d0487746e577e24531eb5370dd51cb466d469a66dfc378b61001c198fcf9c8756	common_voice_en_31865637.mp3	She felt that she could keep filming.	4	0	teens	female	United States English	en	
b5c9bb77e34f76e3130ba662c4ca78975345e97102b27b4b0fa1c4e4780e078d0487746e577e24531eb5370dd51cb466d469a66dfc378b61001c198fcf9c8756	common_voice_en_31865638.mp3	It is also commissioned to launch hydrofoils.	2	0	teens	female	United States English	en	
b5c9bb77e34f76e3130ba662c4ca78975345e97102b27b4b0fa1c4e4780e078d0487746e577e24531eb5370dd51cb466d469a66dfc378b61001c198fcf9c8756	common_voice_en_31865639.mp3	Hinton began her career in education as an elementary schoolteacher in Maryland.	2	0	teens	female	United States English	en	
b5c9bb77e34f76e3130ba662c4ca78975345e97102b27b4b0fa1c4e4780e078d0487746e577e24531eb5370dd51cb466d469a66dfc378b61001c198fcf9c8756	common_voice_en_31865640.mp3	The thallus typically breaks and eventually dissolves into soredia.	4	0	teens	female	United States English	en	
b5c9bb77e34f76e3130ba662c4ca78975345e97102b27b4b0fa1c4e4780e078d0487746e577e24531eb5370dd51cb466d469a66dfc378b61001c198fcf9c8756	common_voice_en_31865642.mp3	Davidson was picked finish fourth.	2	0	teens	female	United States English	en	
b5c9bb77e34f76e3130ba662c4ca78975345e97102b27b4b0fa1c4e4780e078d0487746e577e24531eb5370dd51cb466d469a66dfc378b61001c198fcf9c8756	common_voice_en_31865646.mp3	Buses travel once through Washington Hospital Center.	4	0	teens	female	United States English	en	
b5c9bb77e34f76e3130ba662c4ca78975345e97102b27b4b0fa1c4e4780e078d0487746e577e24531eb5370dd51cb466d469a66dfc378b61001c198fcf9c8756	common_voice_en_31865654.mp3	Thirteen other Palestinians were reportedly injured during the day.	4	0	teens	female	United States English	en	
b5c9bb77e34f76e3130ba662c4ca78975345e97102b27b4b0fa1c4e4780e078d0487746e577e24531eb5370dd51cb466d469a66dfc378b61001c198fcf9c8756	common_voice_en_31865659.mp3	The Alberta restaurant offered free sandwiches on National Grilled Cheese Day.	2	0	teens	female	United States English	en	
b5c9bb77e34f76e3130ba662c4ca78975345e97102b27b4b0fa1c4e4780e078d0487746e577e24531eb5370dd51cb466d469a66dfc378b61001c198fcf9c8756	common_voice_en_31865665.mp3	The capture took place before "Prosperity" had embarked any slaves.	2	0	teens	female	United States English	en	
b5c9bb77e34f76e3130ba662c4ca78975345e97102b27b4b0fa1c4e4780e078d0487746e577e24531eb5370dd51cb466d469a66dfc378b61001c198fcf9c8756	common_voice_en_31865666.mp3	He did not finish his race.	4	0	teens	female	United States English	en	
b5c9bb77e34f76e3130ba662c4ca78975345e97102b27b4b0fa1c4e4780e078d0487746e577e24531eb5370dd51cb466d469a66dfc378b61001c198fcf9c8756	common_voice_en_31865667.mp3	Traditionally they are Barbers by Profession.	4	0	teens	female	United States English	en	
b5c9bb77e34f76e3130ba662c4ca78975345e97102b27b4b0fa1c4e4780e078d0487746e577e24531eb5370dd51cb466d469a66dfc378b61001c198fcf9c8756	common_voice_en_31865674.mp3	This Power Plant is the first ever combined cycle power station in the country.	2	0	teens	female	United States English	en	
b5c9bb77e34f76e3130ba662c4ca78975345e97102b27b4b0fa1c4e4780e078d0487746e577e24531eb5370dd51cb466d469a66dfc378b61001c198fcf9c8756	common_voice_en_31865676.mp3	Local troops of the Russian army also took part in the festivity.	2	0	teens	female	United States English	en	
b5c9bb77e34f76e3130ba662c4ca78975345e97102b27b4b0fa1c4e4780e078d0487746e577e24531eb5370dd51cb466d469a66dfc378b61001c198fcf9c8756	common_voice_en_31865677.mp3	She is an Editor of the American Geophysical Union journal "Earth and Space Science".	4	0	teens	female	United States English	en	
b5c9bb77e34f76e3130ba662c4ca78975345e97102b27b4b0fa1c4e4780e078d0487746e577e24531eb5370dd51cb466d469a66dfc378b61001c198fcf9c8756	common_voice_en_31865678.mp3	She continued to work for the company for three years.	2	0	teens	female	United States English	en	
b5c9bb77e34f76e3130ba662c4ca78975345e97102b27b4b0fa1c4e4780e078d0487746e577e24531eb5370dd51cb466d469a66dfc378b61001c198fcf9c8756	common_voice_en_31865694.mp3	His preferred position is flanker.	4	0	teens	female	United States English	en	
b5c9bb77e34f76e3130ba662c4ca78975345e97102b27b4b0fa1c4e4780e078d0487746e577e24531eb5370dd51cb466d469a66dfc378b61001c198fcf9c8756	common_voice_en_31865695.mp3	His research involves the decision making processes of violent crime offenders in Australia.	2	0	teens	female	United States English	en	
b5c9bb77e34f76e3130ba662c4ca78975345e97102b27b4b0fa1c4e4780e078d0487746e577e24531eb5370dd51cb466d469a66dfc378b61001c198fcf9c8756	common_voice_en_31865697.mp3	Frederick Broke Howell.	6	0	teens	female	United States English	en	
b5c9bb77e34f76e3130ba662c4ca78975345e97102b27b4b0fa1c4e4780e078d0487746e577e24531eb5370dd51cb466d469a66dfc378b61001c198fcf9c8756	common_voice_en_31867237.mp3	Olsen continued pursuit of the Germans until ordered to halt.	2	0	teens	female	United States English	en	
b5c9bb77e34f76e3130ba662c4ca78975345e97102b27b4b0fa1c4e4780e078d0487746e577e24531eb5370dd51cb466d469a66dfc378b61001c198fcf9c8756	common_voice_en_31867240.mp3	He was known for works and lectures focused on sociology and Marxism.	4	0	teens	female	United States English	en	
b5c9bb77e34f76e3130ba662c4ca78975345e97102b27b4b0fa1c4e4780e078d0487746e577e24531eb5370dd51cb466d469a66dfc378b61001c198fcf9c8756	common_voice_en_31867246.mp3	It was the opposite.	4	0	teens	female	United States English	en	
b5c9bb77e34f76e3130ba662c4ca78975345e97102b27b4b0fa1c4e4780e078d0487746e577e24531eb5370dd51cb466d469a66dfc378b61001c198fcf9c8756	common_voice_en_31867247.mp3	Reichard led horticulture trips around the world.	2	0	teens	female	United States English	en	
b5c9bb77e34f76e3130ba662c4ca78975345e97102b27b4b0fa1c4e4780e078d0487746e577e24531eb5370dd51cb466d469a66dfc378b61001c198fcf9c8756	common_voice_en_31867248.mp3	Gangs have control over major roads heading south.	2	0	teens	female	United States English	en	
b5c9bb77e34f76e3130ba662c4ca78975345e97102b27b4b0fa1c4e4780e078d0487746e577e24531eb5370dd51cb466d469a66dfc378b61001c198fcf9c8756	common_voice_en_31867266.mp3	She was also an administrative member of Reporters Without Borders.	2	0	teens	female	United States English	en	
b5c9bb77e34f76e3130ba662c4ca78975345e97102b27b4b0fa1c4e4780e078d0487746e577e24531eb5370dd51cb466d469a66dfc378b61001c198fcf9c8756	common_voice_en_31867268.mp3	The wiring for the lightbulbs is draped across the photos haphazardly.	4	0	teens	female	United States English	en	
b5c9bb77e34f76e3130ba662c4ca78975345e97102b27b4b0fa1c4e4780e078d0487746e577e24531eb5370dd51cb466d469a66dfc378b61001c198fcf9c8756	common_voice_en_31867269.mp3	The Federal Circuit agreed with Cisco and reversed the jury verdict against it.	2	0	teens	female	United States English	en	
b5c9bb77e34f76e3130ba662c4ca78975345e97102b27b4b0fa1c4e4780e078d0487746e577e24531eb5370dd51cb466d469a66dfc378b61001c198fcf9c8756	common_voice_en_31867270.mp3	These are portable and adapted for home use.	4	0	teens	female	United States English	en	
b5c9bb77e34f76e3130ba662c4ca78975345e97102b27b4b0fa1c4e4780e078d0487746e577e24531eb5370dd51cb466d469a66dfc378b61001c198fcf9c8756	common_voice_en_31867281.mp3	Hernandez had pneumonia as young man.	4	0	teens	female	United States English	en	
b5c9bb77e34f76e3130ba662c4ca78975345e97102b27b4b0fa1c4e4780e078d0487746e577e24531eb5370dd51cb466d469a66dfc378b61001c198fcf9c8756	common_voice_en_31867282.mp3	Initial water quality measurements also revealed elevated levels without immediate toxic effects.	2	0	teens	female	United States English	en	
b5c9bb77e34f76e3130ba662c4ca78975345e97102b27b4b0fa1c4e4780e078d0487746e577e24531eb5370dd51cb466d469a66dfc378b61001c198fcf9c8756	common_voice_en_31867283.mp3	The entire area is covered in Nirsa (community development block).	2	0	teens	female	United States English	en	
b5c9bb77e34f76e3130ba662c4ca78975345e97102b27b4b0fa1c4e4780e078d0487746e577e24531eb5370dd51cb466d469a66dfc378b61001c198fcf9c8756	common_voice_en_31867285.mp3	They also neglect the costs associated with delay and inaction.	2	0	teens	female	United States English	en	
b5c9bb77e34f76e3130ba662c4ca78975345e97102b27b4b0fa1c4e4780e078d0487746e577e24531eb5370dd51cb466d469a66dfc378b61001c198fcf9c8756	common_voice_en_31867296.mp3	Women must be partners in the future of Africa.	2	0	teens	female	United States English	en	
b5c9bb77e34f76e3130ba662c4ca78975345e97102b27b4b0fa1c4e4780e078d0487746e577e24531eb5370dd51cb466d469a66dfc378b61001c198fcf9c8756	common_voice_en_31867297.mp3	The bacteria are acidophilic and produce endospores.	4	0	teens	female	United States English	en	
b5c9bb77e34f76e3130ba662c4ca78975345e97102b27b4b0fa1c4e4780e078d0487746e577e24531eb5370dd51cb466d469a66dfc378b61001c198fcf9c8756	common_voice_en_31867299.mp3	Its papers are held at the Birmingham Museum and Art Gallery.	2	0	teens	female	United States English	en	
b5c9bb77e34f76e3130ba662c4ca78975345e97102b27b4b0fa1c4e4780e078d0487746e577e24531eb5370dd51cb466d469a66dfc378b61001c198fcf9c8756	common_voice_en_31867313.mp3	She was the daughter of the Duke Mu of Qin.	4	0	teens	female	United States English	en	
b5c9bb77e34f76e3130ba662c4ca78975345e97102b27b4b0fa1c4e4780e078d0487746e577e24531eb5370dd51cb466d469a66dfc378b61001c198fcf9c8756	common_voice_en_31867322.mp3	She was promoted to First Artist the same year.	2	0	teens	female	United States English	en	
b5c9bb77e34f76e3130ba662c4ca78975345e97102b27b4b0fa1c4e4780e078d0487746e577e24531eb5370dd51cb466d469a66dfc378b61001c198fcf9c8756	common_voice_en_31867325.mp3	This behaviour was not lost upon Mister Pickwick.	2	0	teens	female	United States English	en	
b5c9bb77e34f76e3130ba662c4ca78975345e97102b27b4b0fa1c4e4780e078d0487746e577e24531eb5370dd51cb466d469a66dfc378b61001c198fcf9c8756	common_voice_en_31867335.mp3	He was last seen in the film "Master".	6	0	teens	female	United States English	en	
b5c9bb77e34f76e3130ba662c4ca78975345e97102b27b4b0fa1c4e4780e078d0487746e577e24531eb5370dd51cb466d469a66dfc378b61001c198fcf9c8756	common_voice_en_31867338.mp3	The current principal is Tomoko Owada.	4	0	teens	female	United States English	en	
b5c9bb77e34f76e3130ba662c4ca78975345e97102b27b4b0fa1c4e4780e078d0487746e577e24531eb5370dd51cb466d469a66dfc378b61001c198fcf9c8756	common_voice_en_31867352.mp3	Darby met Elva Louise while they attended high school together.	4	0	teens	female	United States English	en	
b5c9bb77e34f76e3130ba662c4ca78975345e97102b27b4b0fa1c4e4780e078d0487746e577e24531eb5370dd51cb466d469a66dfc378b61001c198fcf9c8756	common_voice_en_31867356.mp3	These iron window grills were painted with red lead and finished with vermilion.	2	0	teens	female	United States English	en	
b5c9bb77e34f76e3130ba662c4ca78975345e97102b27b4b0fa1c4e4780e078d0487746e577e24531eb5370dd51cb466d469a66dfc378b61001c198fcf9c8756	common_voice_en_31867361.mp3	His later business includes an oil palm plantation in Maluku.	4	0	teens	female	United States English	en	
b5c9bb77e34f76e3130ba662c4ca78975345e97102b27b4b0fa1c4e4780e078d0487746e577e24531eb5370dd51cb466d469a66dfc378b61001c198fcf9c8756	common_voice_en_31867363.mp3	He then played college football at Arizona State.	4	0	teens	female	United States English	en	
b5c9bb77e34f76e3130ba662c4ca78975345e97102b27b4b0fa1c4e4780e078d0487746e577e24531eb5370dd51cb466d469a66dfc378b61001c198fcf9c8756	common_voice_en_31867365.mp3	Htun first married Daw Saw.	2	0	teens	female	United States English	en	
b5c9bb77e34f76e3130ba662c4ca78975345e97102b27b4b0fa1c4e4780e078d0487746e577e24531eb5370dd51cb466d469a66dfc378b61001c198fcf9c8756	common_voice_en_31867385.mp3	It has jurisdiction over the field of veterinary and animal sciences in Bihar.	4	0	teens	female	United States English	en	
b5c9bb77e34f76e3130ba662c4ca78975345e97102b27b4b0fa1c4e4780e078d0487746e577e24531eb5370dd51cb466d469a66dfc378b61001c198fcf9c8756	common_voice_en_31867387.mp3	Liturgy of Saint James is celebrated on Sundays and special occasions.	2	0	teens	female	United States English	en	
b5c9bb77e34f76e3130ba662c4ca78975345e97102b27b4b0fa1c4e4780e078d0487746e577e24531eb5370dd51cb466d469a66dfc378b61001c198fcf9c8756	common_voice_en_31867388.mp3	She has earned the title of first female folk rapper of India.	4	0	teens	female	United States English	en	
b5c9bb77e34f76e3130ba662c4ca78975345e97102b27b4b0fa1c4e4780e078d0487746e577e24531eb5370dd51cb466d469a66dfc378b61001c198fcf9c8756	common_voice_en_31867403.mp3	He then became an Affiliated Professor at the Ohio Aerospace Institute.	4	0	teens	female	United States English	en	
b5c9bb77e34f76e3130ba662c4ca78975345e97102b27b4b0fa1c4e4780e078d0487746e577e24531eb5370dd51cb466d469a66dfc378b61001c198fcf9c8756	common_voice_en_31867421.mp3	Huey discovers that the ring is stuck on his finger.	2	0	teens	female	United States English	en	
b5c9bb77e34f76e3130ba662c4ca78975345e97102b27b4b0fa1c4e4780e078d0487746e577e24531eb5370dd51cb466d469a66dfc378b61001c198fcf9c8756	common_voice_en_31867422.mp3	Norris later emigrated to France.	4	2	teens	female	United States English	en	
b5c9bb77e34f76e3130ba662c4ca78975345e97102b27b4b0fa1c4e4780e078d0487746e577e24531eb5370dd51cb466d469a66dfc378b61001c198fcf9c8756	common_voice_en_31867423.mp3	The Great Pagoda was completed in only six months.	2	0	teens	female	United States English	en	
b5c9bb77e34f76e3130ba662c4ca78975345e97102b27b4b0fa1c4e4780e078d0487746e577e24531eb5370dd51cb466d469a66dfc378b61001c198fcf9c8756	common_voice_en_31867437.mp3	Richard Burrill was the team captain.	2	0	teens	female	United States English	en	
b5c9bb77e34f76e3130ba662c4ca78975345e97102b27b4b0fa1c4e4780e078d0487746e577e24531eb5370dd51cb466d469a66dfc378b61001c198fcf9c8756	common_voice_en_31867450.mp3	He was noted for supporting moves to prevent electoral corruption.	4	0	teens	female	United States English	en	
b5c9bb77e34f76e3130ba662c4ca78975345e97102b27b4b0fa1c4e4780e078d0487746e577e24531eb5370dd51cb466d469a66dfc378b61001c198fcf9c8756	common_voice_en_31867452.mp3	Its native range is Kenya to Mozambique and the Western Indian Ocean.	6	0	teens	female	United States English	en	
b5c9bb77e34f76e3130ba662c4ca78975345e97102b27b4b0fa1c4e4780e078d0487746e577e24531eb5370dd51cb466d469a66dfc378b61001c198fcf9c8756	common_voice_en_31867453.mp3	Galloway has two daughters.	6	0	teens	female	United States English	en	
b5c9bb77e34f76e3130ba662c4ca78975345e97102b27b4b0fa1c4e4780e078d0487746e577e24531eb5370dd51cb466d469a66dfc378b61001c198fcf9c8756	common_voice_en_31867466.mp3	It takes its name from the Via Trionfale.	2	0	teens	female	United States English	en	
b5c9bb77e34f76e3130ba662c4ca78975345e97102b27b4b0fa1c4e4780e078d0487746e577e24531eb5370dd51cb466d469a66dfc378b61001c198fcf9c8756	common_voice_en_31867473.mp3	He studied the Mayan language when he arrived in Mexico.	2	0	teens	female	United States English	en	
b5c9bb77e34f76e3130ba662c4ca78975345e97102b27b4b0fa1c4e4780e078d0487746e577e24531eb5370dd51cb466d469a66dfc378b61001c198fcf9c8756	common_voice_en_31867483.mp3	Her parents were immigrants from Italy.	2	0	teens	female	United States English	en	
b5c9bb77e34f76e3130ba662c4ca78975345e97102b27b4b0fa1c4e4780e078d0487746e577e24531eb5370dd51cb466d469a66dfc378b61001c198fcf9c8756	common_voice_en_31867484.mp3	Her professional film career began as an electrician.	4	0	teens	female	United States English	en	
b5c9bb77e34f76e3130ba662c4ca78975345e97102b27b4b0fa1c4e4780e078d0487746e577e24531eb5370dd51cb466d469a66dfc378b61001c198fcf9c8756	common_voice_en_31867487.mp3	Successful candidates attended an online counseling procedure.	2	0	teens	female	United States English	en	
b5c9bb77e34f76e3130ba662c4ca78975345e97102b27b4b0fa1c4e4780e078d0487746e577e24531eb5370dd51cb466d469a66dfc378b61001c198fcf9c8756	common_voice_en_31867494.mp3	The guest chefs vary per season.	4	0	teens	female	United States English	en	
b5c9bb77e34f76e3130ba662c4ca78975345e97102b27b4b0fa1c4e4780e078d0487746e577e24531eb5370dd51cb466d469a66dfc378b61001c198fcf9c8756	common_voice_en_31867498.mp3	A music video was also made to accompany the song.	2	0	teens	female	United States English	en	
b5c9bb77e34f76e3130ba662c4ca78975345e97102b27b4b0fa1c4e4780e078d0487746e577e24531eb5370dd51cb466d469a66dfc378b61001c198fcf9c8756	common_voice_en_31867514.mp3	No team promoted or relegated this season.	2	0	teens	female	United States English	en	
b5c9bb77e34f76e3130ba662c4ca78975345e97102b27b4b0fa1c4e4780e078d0487746e577e24531eb5370dd51cb466d469a66dfc378b61001c198fcf9c8756	common_voice_en_31867515.mp3	The night comes.	4	0	teens	female	United States English	en	
b5c9bb77e34f76e3130ba662c4ca78975345e97102b27b4b0fa1c4e4780e078d0487746e577e24531eb5370dd51cb466d469a66dfc378b61001c198fcf9c8756	common_voice_en_31867516.mp3	The station is owned by the Pentecostal Revival Association.	2	0	teens	female	United States English	en	
b5c9bb77e34f76e3130ba662c4ca78975345e97102b27b4b0fa1c4e4780e078d0487746e577e24531eb5370dd51cb466d469a66dfc378b61001c198fcf9c8756	common_voice_en_31867517.mp3	His doctoral thesis examines early conducting techniques.	4	0	teens	female	United States English	en	
b5c9bb77e34f76e3130ba662c4ca78975345e97102b27b4b0fa1c4e4780e078d0487746e577e24531eb5370dd51cb466d469a66dfc378b61001c198fcf9c8756	common_voice_en_31867531.mp3	Its pink to purple flowers may be seen from September to December.	2	0	teens	female	United States English	en	
b5c9bb77e34f76e3130ba662c4ca78975345e97102b27b4b0fa1c4e4780e078d0487746e577e24531eb5370dd51cb466d469a66dfc378b61001c198fcf9c8756	common_voice_en_31867539.mp3	He was educated at Trinity College Dublin.	2	0	teens	female	United States English	en	
