client_id	path	sentence	up_votes	down_votes	age	gender	accents	locale	segment
edad0b3940194e23c9d402b752e8340513a02427a3ab889f673f43309499bc450e46716041fcf08ccc983afe02e9f32a85d424b14bb6c0347aa4af3865a72a3b	common_voice_en_32195442.mp3	Knowledge would then be passed down from generation to generation until the present day.	2	0			England English	en	
edad0b3940194e23c9d402b752e8340513a02427a3ab889f673f43309499bc450e46716041fcf08ccc983afe02e9f32a85d424b14bb6c0347aa4af3865a72a3b	common_voice_en_32195444.mp3	Fossils of starfish have been found at several sites in the Kristianstad Basin.	2	0			England English	en	
edad0b3940194e23c9d402b752e8340513a02427a3ab889f673f43309499bc450e46716041fcf08ccc983afe02e9f32a85d424b14bb6c0347aa4af3865a72a3b	common_voice_en_32195446.mp3	It was an abolitionist newspaper that reported on the activities of the Underground Railroad.	2	0			England English	en	
edad0b3940194e23c9d402b752e8340513a02427a3ab889f673f43309499bc450e46716041fcf08ccc983afe02e9f32a85d424b14bb6c0347aa4af3865a72a3b	common_voice_en_32195447.mp3	Strength slowly regenerates over time.	4	0			England English	en	
edad0b3940194e23c9d402b752e8340513a02427a3ab889f673f43309499bc450e46716041fcf08ccc983afe02e9f32a85d424b14bb6c0347aa4af3865a72a3b	common_voice_en_32195452.mp3	The burials are exclusively confined to males.	2	0			England English	en	
edad0b3940194e23c9d402b752e8340513a02427a3ab889f673f43309499bc450e46716041fcf08ccc983afe02e9f32a85d424b14bb6c0347aa4af3865a72a3b	common_voice_en_32195453.mp3	Not all cast members were credited.	4	0			England English	en	
edad0b3940194e23c9d402b752e8340513a02427a3ab889f673f43309499bc450e46716041fcf08ccc983afe02e9f32a85d424b14bb6c0347aa4af3865a72a3b	common_voice_en_32195458.mp3	Blue denotes races won by Democrats.	4	0			England English	en	
edad0b3940194e23c9d402b752e8340513a02427a3ab889f673f43309499bc450e46716041fcf08ccc983afe02e9f32a85d424b14bb6c0347aa4af3865a72a3b	common_voice_en_32195460.mp3	This was criticized by the voters who voted for him.	2	0			England English	en	
edad0b3940194e23c9d402b752e8340513a02427a3ab889f673f43309499bc450e46716041fcf08ccc983afe02e9f32a85d424b14bb6c0347aa4af3865a72a3b	common_voice_en_32195467.mp3	The time and frequency representations are complementary to one another.	2	0			England English	en	
edad0b3940194e23c9d402b752e8340513a02427a3ab889f673f43309499bc450e46716041fcf08ccc983afe02e9f32a85d424b14bb6c0347aa4af3865a72a3b	common_voice_en_32195477.mp3	Elkhorn Road begins at Egan Crest Drive in the northwestern corner of Las Vegas.	2	0			England English	en	
edad0b3940194e23c9d402b752e8340513a02427a3ab889f673f43309499bc450e46716041fcf08ccc983afe02e9f32a85d424b14bb6c0347aa4af3865a72a3b	common_voice_en_32195483.mp3	He was crucified upside down.	2	0			England English	en	
edad0b3940194e23c9d402b752e8340513a02427a3ab889f673f43309499bc450e46716041fcf08ccc983afe02e9f32a85d424b14bb6c0347aa4af3865a72a3b	common_voice_en_32195488.mp3	Al Ahed	2	0			England English	en	
edad0b3940194e23c9d402b752e8340513a02427a3ab889f673f43309499bc450e46716041fcf08ccc983afe02e9f32a85d424b14bb6c0347aa4af3865a72a3b	common_voice_en_32195492.mp3	It is locally used in traditional medicine.	2	0			England English	en	
edad0b3940194e23c9d402b752e8340513a02427a3ab889f673f43309499bc450e46716041fcf08ccc983afe02e9f32a85d424b14bb6c0347aa4af3865a72a3b	common_voice_en_32195496.mp3	Before the ferry line opened the residents needed to use their own boat.	4	0			England English	en	
edad0b3940194e23c9d402b752e8340513a02427a3ab889f673f43309499bc450e46716041fcf08ccc983afe02e9f32a85d424b14bb6c0347aa4af3865a72a3b	common_voice_en_32195513.mp3	Appointed as Peer of France.	4	0			England English	en	
edad0b3940194e23c9d402b752e8340513a02427a3ab889f673f43309499bc450e46716041fcf08ccc983afe02e9f32a85d424b14bb6c0347aa4af3865a72a3b	common_voice_en_32195514.mp3	The song "High Hopes" by Panic!	4	0			England English	en	
edad0b3940194e23c9d402b752e8340513a02427a3ab889f673f43309499bc450e46716041fcf08ccc983afe02e9f32a85d424b14bb6c0347aa4af3865a72a3b	common_voice_en_32195520.mp3	He spent many years in going through them.	2	0			England English	en	
edad0b3940194e23c9d402b752e8340513a02427a3ab889f673f43309499bc450e46716041fcf08ccc983afe02e9f32a85d424b14bb6c0347aa4af3865a72a3b	common_voice_en_32195521.mp3	He also helped design and launch the website of Radio Farda.	2	0			England English	en	
edad0b3940194e23c9d402b752e8340513a02427a3ab889f673f43309499bc450e46716041fcf08ccc983afe02e9f32a85d424b14bb6c0347aa4af3865a72a3b	common_voice_en_32195527.mp3	These include British players with dual citizenship.	2	0			England English	en	
edad0b3940194e23c9d402b752e8340513a02427a3ab889f673f43309499bc450e46716041fcf08ccc983afe02e9f32a85d424b14bb6c0347aa4af3865a72a3b	common_voice_en_32195541.mp3	Credits adapted from the original vinyl release.	4	0			England English	en	
edad0b3940194e23c9d402b752e8340513a02427a3ab889f673f43309499bc450e46716041fcf08ccc983afe02e9f32a85d424b14bb6c0347aa4af3865a72a3b	common_voice_en_32195553.mp3	She was the first woman in India to have her child marriage nullified.	2	0			England English	en	
edad0b3940194e23c9d402b752e8340513a02427a3ab889f673f43309499bc450e46716041fcf08ccc983afe02e9f32a85d424b14bb6c0347aa4af3865a72a3b	common_voice_en_32195554.mp3	Pollak received the "Radio Prize of Adult Education" for this work.	4	0			England English	en	
edad0b3940194e23c9d402b752e8340513a02427a3ab889f673f43309499bc450e46716041fcf08ccc983afe02e9f32a85d424b14bb6c0347aa4af3865a72a3b	common_voice_en_32195556.mp3	He was also accused of intimidating the victims.	2	0			England English	en	
edad0b3940194e23c9d402b752e8340513a02427a3ab889f673f43309499bc450e46716041fcf08ccc983afe02e9f32a85d424b14bb6c0347aa4af3865a72a3b	common_voice_en_32195558.mp3	It then changed hands several times over the next few years.	6	0			England English	en	
edad0b3940194e23c9d402b752e8340513a02427a3ab889f673f43309499bc450e46716041fcf08ccc983afe02e9f32a85d424b14bb6c0347aa4af3865a72a3b	common_voice_en_32195559.mp3	The game carries an official World Rally Championship esports licence.	6	4			England English	en	
edad0b3940194e23c9d402b752e8340513a02427a3ab889f673f43309499bc450e46716041fcf08ccc983afe02e9f32a85d424b14bb6c0347aa4af3865a72a3b	common_voice_en_32195578.mp3	Frederiksen was interested in politics from an early age.	2	0			England English	en	
edad0b3940194e23c9d402b752e8340513a02427a3ab889f673f43309499bc450e46716041fcf08ccc983afe02e9f32a85d424b14bb6c0347aa4af3865a72a3b	common_voice_en_32195579.mp3	It comprised ten teams composed of both women and men.	4	0			England English	en	
edad0b3940194e23c9d402b752e8340513a02427a3ab889f673f43309499bc450e46716041fcf08ccc983afe02e9f32a85d424b14bb6c0347aa4af3865a72a3b	common_voice_en_32195585.mp3	Little is known of his life outside of his recordings.	2	0			England English	en	
edad0b3940194e23c9d402b752e8340513a02427a3ab889f673f43309499bc450e46716041fcf08ccc983afe02e9f32a85d424b14bb6c0347aa4af3865a72a3b	common_voice_en_32195587.mp3	He played college football at Springfield College in Massachusetts.	2	0			England English	en	
edad0b3940194e23c9d402b752e8340513a02427a3ab889f673f43309499bc450e46716041fcf08ccc983afe02e9f32a85d424b14bb6c0347aa4af3865a72a3b	common_voice_en_32195605.mp3	The rebel chief was also decapitated.	2	0			England English	en	
edad0b3940194e23c9d402b752e8340513a02427a3ab889f673f43309499bc450e46716041fcf08ccc983afe02e9f32a85d424b14bb6c0347aa4af3865a72a3b	common_voice_en_32195608.mp3	She collaborates regularly with artists and designers.	2	0			England English	en	
edad0b3940194e23c9d402b752e8340513a02427a3ab889f673f43309499bc450e46716041fcf08ccc983afe02e9f32a85d424b14bb6c0347aa4af3865a72a3b	common_voice_en_32195653.mp3	The privileges of the church were confirmed by an imperial diploma.	2	0			England English	en	
edad0b3940194e23c9d402b752e8340513a02427a3ab889f673f43309499bc450e46716041fcf08ccc983afe02e9f32a85d424b14bb6c0347aa4af3865a72a3b	common_voice_en_32195671.mp3	She is known for her high intelligence which gave her the name Hawkins	2	0			England English	en	
edad0b3940194e23c9d402b752e8340513a02427a3ab889f673f43309499bc450e46716041fcf08ccc983afe02e9f32a85d424b14bb6c0347aa4af3865a72a3b	common_voice_en_32195674.mp3	Foreign residents were also attracted to his cause.	6	0			England English	en	
edad0b3940194e23c9d402b752e8340513a02427a3ab889f673f43309499bc450e46716041fcf08ccc983afe02e9f32a85d424b14bb6c0347aa4af3865a72a3b	common_voice_en_32195684.mp3	Syunbash is the nearest rural locality.	6	0			England English	en	
edad0b3940194e23c9d402b752e8340513a02427a3ab889f673f43309499bc450e46716041fcf08ccc983afe02e9f32a85d424b14bb6c0347aa4af3865a72a3b	common_voice_en_32195691.mp3	They were active through Persian and Hellenistic times.	2	0			England English	en	
edad0b3940194e23c9d402b752e8340513a02427a3ab889f673f43309499bc450e46716041fcf08ccc983afe02e9f32a85d424b14bb6c0347aa4af3865a72a3b	common_voice_en_32195701.mp3	It was the first competition won by Boca Juniors outside Argentina.	2	0			England English	en	
edad0b3940194e23c9d402b752e8340513a02427a3ab889f673f43309499bc450e46716041fcf08ccc983afe02e9f32a85d424b14bb6c0347aa4af3865a72a3b	common_voice_en_32195721.mp3	Preserved stomach contents and intestinal contents were also recovered.	2	0			England English	en	
edad0b3940194e23c9d402b752e8340513a02427a3ab889f673f43309499bc450e46716041fcf08ccc983afe02e9f32a85d424b14bb6c0347aa4af3865a72a3b	common_voice_en_32195730.mp3	It also preserves the principle of facultative academic fencing.	8	2			England English	en	
edad0b3940194e23c9d402b752e8340513a02427a3ab889f673f43309499bc450e46716041fcf08ccc983afe02e9f32a85d424b14bb6c0347aa4af3865a72a3b	common_voice_en_32195733.mp3	Books written in the Arabic alphabet have fallen apart and become unreadable.	2	0			England English	en	
edad0b3940194e23c9d402b752e8340513a02427a3ab889f673f43309499bc450e46716041fcf08ccc983afe02e9f32a85d424b14bb6c0347aa4af3865a72a3b	common_voice_en_32195735.mp3	Perhaps it was the case of exhibiting it in art galleries.	2	0			England English	en	
edad0b3940194e23c9d402b752e8340513a02427a3ab889f673f43309499bc450e46716041fcf08ccc983afe02e9f32a85d424b14bb6c0347aa4af3865a72a3b	common_voice_en_32195736.mp3	Completion of the monument took about nine years.	2	0			England English	en	
edad0b3940194e23c9d402b752e8340513a02427a3ab889f673f43309499bc450e46716041fcf08ccc983afe02e9f32a85d424b14bb6c0347aa4af3865a72a3b	common_voice_en_32195747.mp3	Kelly Kulick was chosen as the initial Empress.	4	0			England English	en	
edad0b3940194e23c9d402b752e8340513a02427a3ab889f673f43309499bc450e46716041fcf08ccc983afe02e9f32a85d424b14bb6c0347aa4af3865a72a3b	common_voice_en_32195749.mp3	All songs written by Eleanor Friedberger.	2	0			England English	en	
edad0b3940194e23c9d402b752e8340513a02427a3ab889f673f43309499bc450e46716041fcf08ccc983afe02e9f32a85d424b14bb6c0347aa4af3865a72a3b	common_voice_en_32195750.mp3	She becomes pregnant with his child.	2	0			England English	en	
edad0b3940194e23c9d402b752e8340513a02427a3ab889f673f43309499bc450e46716041fcf08ccc983afe02e9f32a85d424b14bb6c0347aa4af3865a72a3b	common_voice_en_32195753.mp3	She is the current Minister of Defence.	2	0			England English	en	
edad0b3940194e23c9d402b752e8340513a02427a3ab889f673f43309499bc450e46716041fcf08ccc983afe02e9f32a85d424b14bb6c0347aa4af3865a72a3b	common_voice_en_32195767.mp3	Title holder was Diane Valkenburg.	4	0			England English	en	
edad0b3940194e23c9d402b752e8340513a02427a3ab889f673f43309499bc450e46716041fcf08ccc983afe02e9f32a85d424b14bb6c0347aa4af3865a72a3b	common_voice_en_32195768.mp3	He published extensively on classical literature.	2	0			England English	en	
edad0b3940194e23c9d402b752e8340513a02427a3ab889f673f43309499bc450e46716041fcf08ccc983afe02e9f32a85d424b14bb6c0347aa4af3865a72a3b	common_voice_en_32195772.mp3	The van version was sold only in Europe.	2	0			England English	en	
edad0b3940194e23c9d402b752e8340513a02427a3ab889f673f43309499bc450e46716041fcf08ccc983afe02e9f32a85d424b14bb6c0347aa4af3865a72a3b	common_voice_en_32195773.mp3	Sourav Kothari and Emma Bonney won the World Billiards Championships for each gender.	2	0			England English	en	
edad0b3940194e23c9d402b752e8340513a02427a3ab889f673f43309499bc450e46716041fcf08ccc983afe02e9f32a85d424b14bb6c0347aa4af3865a72a3b	common_voice_en_32195775.mp3	She was the first woman to represent Italy at the Olympics.	4	0			England English	en	
edad0b3940194e23c9d402b752e8340513a02427a3ab889f673f43309499bc450e46716041fcf08ccc983afe02e9f32a85d424b14bb6c0347aa4af3865a72a3b	common_voice_en_32195776.mp3	Gentile and Pecoraro also reflect upon the weight that the Hodel name carries.	4	0			England English	en	
edad0b3940194e23c9d402b752e8340513a02427a3ab889f673f43309499bc450e46716041fcf08ccc983afe02e9f32a85d424b14bb6c0347aa4af3865a72a3b	common_voice_en_32195780.mp3	Kobayashi won the fight by unanimous decision.	2	0			England English	en	
edad0b3940194e23c9d402b752e8340513a02427a3ab889f673f43309499bc450e46716041fcf08ccc983afe02e9f32a85d424b14bb6c0347aa4af3865a72a3b	common_voice_en_32195782.mp3	There are seven turns to the right and ten left.	4	2			England English	en	
edad0b3940194e23c9d402b752e8340513a02427a3ab889f673f43309499bc450e46716041fcf08ccc983afe02e9f32a85d424b14bb6c0347aa4af3865a72a3b	common_voice_en_32195790.mp3	Later that year he released the song "Blue Christmas".	6	0			England English	en	
edad0b3940194e23c9d402b752e8340513a02427a3ab889f673f43309499bc450e46716041fcf08ccc983afe02e9f32a85d424b14bb6c0347aa4af3865a72a3b	common_voice_en_32195791.mp3	It is administrated under the Pune Division.	2	0			England English	en	
edad0b3940194e23c9d402b752e8340513a02427a3ab889f673f43309499bc450e46716041fcf08ccc983afe02e9f32a85d424b14bb6c0347aa4af3865a72a3b	common_voice_en_32195808.mp3	There is also confusion over the possible larval host plants for this species.	2	0			England English	en	
edad0b3940194e23c9d402b752e8340513a02427a3ab889f673f43309499bc450e46716041fcf08ccc983afe02e9f32a85d424b14bb6c0347aa4af3865a72a3b	common_voice_en_32195812.mp3	The British Museum holds examples of her work.	4	0			England English	en	
edad0b3940194e23c9d402b752e8340513a02427a3ab889f673f43309499bc450e46716041fcf08ccc983afe02e9f32a85d424b14bb6c0347aa4af3865a72a3b	common_voice_en_32195828.mp3	Hela began her work to fully resurrect Thanos.	2	0			England English	en	
edad0b3940194e23c9d402b752e8340513a02427a3ab889f673f43309499bc450e46716041fcf08ccc983afe02e9f32a85d424b14bb6c0347aa4af3865a72a3b	common_voice_en_32195829.mp3	She is buried in the Civil Cemetery in Madrid.	2	0			England English	en	
edad0b3940194e23c9d402b752e8340513a02427a3ab889f673f43309499bc450e46716041fcf08ccc983afe02e9f32a85d424b14bb6c0347aa4af3865a72a3b	common_voice_en_32195830.mp3	Most obvious is the Frog Prince.	2	0			England English	en	
edad0b3940194e23c9d402b752e8340513a02427a3ab889f673f43309499bc450e46716041fcf08ccc983afe02e9f32a85d424b14bb6c0347aa4af3865a72a3b	common_voice_en_32195832.mp3	No Italian woman took part in this first edition of the world championships.	6	0			England English	en	
edad0b3940194e23c9d402b752e8340513a02427a3ab889f673f43309499bc450e46716041fcf08ccc983afe02e9f32a85d424b14bb6c0347aa4af3865a72a3b	common_voice_en_32195833.mp3	Then you flew me out to Jordan and did this incredible video shoot.	2	0			England English	en	
edad0b3940194e23c9d402b752e8340513a02427a3ab889f673f43309499bc450e46716041fcf08ccc983afe02e9f32a85d424b14bb6c0347aa4af3865a72a3b	common_voice_en_32195839.mp3	Lynch Brothers.	2	0			England English	en	
edad0b3940194e23c9d402b752e8340513a02427a3ab889f673f43309499bc450e46716041fcf08ccc983afe02e9f32a85d424b14bb6c0347aa4af3865a72a3b	common_voice_en_32195846.mp3	There is access from Marlow Road.	4	0			England English	en	
edad0b3940194e23c9d402b752e8340513a02427a3ab889f673f43309499bc450e46716041fcf08ccc983afe02e9f32a85d424b14bb6c0347aa4af3865a72a3b	common_voice_en_32195858.mp3	He received his baptism of fire in the battle for Moscow.	2	0			England English	en	
edad0b3940194e23c9d402b752e8340513a02427a3ab889f673f43309499bc450e46716041fcf08ccc983afe02e9f32a85d424b14bb6c0347aa4af3865a72a3b	common_voice_en_32195873.mp3	He acted in and also directed plays.	4	0			England English	en	
edad0b3940194e23c9d402b752e8340513a02427a3ab889f673f43309499bc450e46716041fcf08ccc983afe02e9f32a85d424b14bb6c0347aa4af3865a72a3b	common_voice_en_32195878.mp3	Brazil won all five of their games.	2	0			England English	en	
edad0b3940194e23c9d402b752e8340513a02427a3ab889f673f43309499bc450e46716041fcf08ccc983afe02e9f32a85d424b14bb6c0347aa4af3865a72a3b	common_voice_en_32248019.mp3	The Western Region Office responded that there were no funds available for art.	4	0			England English	en	
edad0b3940194e23c9d402b752e8340513a02427a3ab889f673f43309499bc450e46716041fcf08ccc983afe02e9f32a85d424b14bb6c0347aa4af3865a72a3b	common_voice_en_32248022.mp3	Deutsch died the following year during childbirth.	4	0			England English	en	
edad0b3940194e23c9d402b752e8340513a02427a3ab889f673f43309499bc450e46716041fcf08ccc983afe02e9f32a85d424b14bb6c0347aa4af3865a72a3b	common_voice_en_32248023.mp3	The film features Maggie Simpson.	2	0			England English	en	
edad0b3940194e23c9d402b752e8340513a02427a3ab889f673f43309499bc450e46716041fcf08ccc983afe02e9f32a85d424b14bb6c0347aa4af3865a72a3b	common_voice_en_32248426.mp3	Bob Marks and Mike Vincent were the team captains.	2	0			England English	en	
edad0b3940194e23c9d402b752e8340513a02427a3ab889f673f43309499bc450e46716041fcf08ccc983afe02e9f32a85d424b14bb6c0347aa4af3865a72a3b	common_voice_en_32248429.mp3	The bridges built over the course of four years.	2	0			England English	en	
edad0b3940194e23c9d402b752e8340513a02427a3ab889f673f43309499bc450e46716041fcf08ccc983afe02e9f32a85d424b14bb6c0347aa4af3865a72a3b	common_voice_en_32248433.mp3	He also had an interest in writing and poetry.	2	0			England English	en	
edad0b3940194e23c9d402b752e8340513a02427a3ab889f673f43309499bc450e46716041fcf08ccc983afe02e9f32a85d424b14bb6c0347aa4af3865a72a3b	common_voice_en_32248436.mp3	The Crimean War ended with the Treaty of Paris the following month.	2	0			England English	en	
edad0b3940194e23c9d402b752e8340513a02427a3ab889f673f43309499bc450e46716041fcf08ccc983afe02e9f32a85d424b14bb6c0347aa4af3865a72a3b	common_voice_en_32248437.mp3	Gaye was born in Norway and is of Gambian descent.	4	0			England English	en	
edad0b3940194e23c9d402b752e8340513a02427a3ab889f673f43309499bc450e46716041fcf08ccc983afe02e9f32a85d424b14bb6c0347aa4af3865a72a3b	common_voice_en_32248438.mp3	It flowers year round.	4	0			England English	en	
edad0b3940194e23c9d402b752e8340513a02427a3ab889f673f43309499bc450e46716041fcf08ccc983afe02e9f32a85d424b14bb6c0347aa4af3865a72a3b	common_voice_en_32248440.mp3	Both newlyweds lied about their age.	4	0			England English	en	
edad0b3940194e23c9d402b752e8340513a02427a3ab889f673f43309499bc450e46716041fcf08ccc983afe02e9f32a85d424b14bb6c0347aa4af3865a72a3b	common_voice_en_32248443.mp3	Admission to the school would be restricted to girls.	4	0			England English	en	
edad0b3940194e23c9d402b752e8340513a02427a3ab889f673f43309499bc450e46716041fcf08ccc983afe02e9f32a85d424b14bb6c0347aa4af3865a72a3b	common_voice_en_32248446.mp3	She and Thabo then went to live with her paternal grandmother.	2	0			England English	en	
edad0b3940194e23c9d402b752e8340513a02427a3ab889f673f43309499bc450e46716041fcf08ccc983afe02e9f32a85d424b14bb6c0347aa4af3865a72a3b	common_voice_en_32248447.mp3	He is married to Viviana Nieman and has three children.	2	0			England English	en	
edad0b3940194e23c9d402b752e8340513a02427a3ab889f673f43309499bc450e46716041fcf08ccc983afe02e9f32a85d424b14bb6c0347aa4af3865a72a3b	common_voice_en_32248454.mp3	Three editorial board members were fired in connection to this matter.	2	0			England English	en	
edad0b3940194e23c9d402b752e8340513a02427a3ab889f673f43309499bc450e46716041fcf08ccc983afe02e9f32a85d424b14bb6c0347aa4af3865a72a3b	common_voice_en_32248455.mp3	The brother and sister thus went to the police.	2	0			England English	en	
edad0b3940194e23c9d402b752e8340513a02427a3ab889f673f43309499bc450e46716041fcf08ccc983afe02e9f32a85d424b14bb6c0347aa4af3865a72a3b	common_voice_en_32248457.mp3	It started out as cyberbullying but it quickly evolved.	2	0			England English	en	
edad0b3940194e23c9d402b752e8340513a02427a3ab889f673f43309499bc450e46716041fcf08ccc983afe02e9f32a85d424b14bb6c0347aa4af3865a72a3b	common_voice_en_32248462.mp3	Some of drawings in the Lulls album depict gems at actual size.	2	0			England English	en	
edad0b3940194e23c9d402b752e8340513a02427a3ab889f673f43309499bc450e46716041fcf08ccc983afe02e9f32a85d424b14bb6c0347aa4af3865a72a3b	common_voice_en_32248469.mp3	This season all shows were aired live.	6	0			England English	en	
edad0b3940194e23c9d402b752e8340513a02427a3ab889f673f43309499bc450e46716041fcf08ccc983afe02e9f32a85d424b14bb6c0347aa4af3865a72a3b	common_voice_en_32248482.mp3	Individual provinces have specific rules toward travellers from outside of Atlantic Canada.	2	0			England English	en	
edad0b3940194e23c9d402b752e8340513a02427a3ab889f673f43309499bc450e46716041fcf08ccc983afe02e9f32a85d424b14bb6c0347aa4af3865a72a3b	common_voice_en_32248483.mp3	Henry Vere White also served as chaplains to the chapel.	2	0			England English	en	
edad0b3940194e23c9d402b752e8340513a02427a3ab889f673f43309499bc450e46716041fcf08ccc983afe02e9f32a85d424b14bb6c0347aa4af3865a72a3b	common_voice_en_32248486.mp3	For about four years they lived in Colorado.	4	0			England English	en	
edad0b3940194e23c9d402b752e8340513a02427a3ab889f673f43309499bc450e46716041fcf08ccc983afe02e9f32a85d424b14bb6c0347aa4af3865a72a3b	common_voice_en_32248490.mp3	Together they became mainstays of the Coville burlesque companies.	2	0			England English	en	
edad0b3940194e23c9d402b752e8340513a02427a3ab889f673f43309499bc450e46716041fcf08ccc983afe02e9f32a85d424b14bb6c0347aa4af3865a72a3b	common_voice_en_32248491.mp3	They are made of sandstone from Bela Voda.	2	0			England English	en	
edad0b3940194e23c9d402b752e8340513a02427a3ab889f673f43309499bc450e46716041fcf08ccc983afe02e9f32a85d424b14bb6c0347aa4af3865a72a3b	common_voice_en_32248500.mp3	Israeli Prime Minister Benjamin Netanyahu addressed the Congress on its opening day.	2	0			England English	en	
edad0b3940194e23c9d402b752e8340513a02427a3ab889f673f43309499bc450e46716041fcf08ccc983afe02e9f32a85d424b14bb6c0347aa4af3865a72a3b	common_voice_en_32248502.mp3	Or German idealism?	2	0			England English	en	
edad0b3940194e23c9d402b752e8340513a02427a3ab889f673f43309499bc450e46716041fcf08ccc983afe02e9f32a85d424b14bb6c0347aa4af3865a72a3b	common_voice_en_32248508.mp3	Artists flocked to the summer cottages along the shores.	2	0			England English	en	
edad0b3940194e23c9d402b752e8340513a02427a3ab889f673f43309499bc450e46716041fcf08ccc983afe02e9f32a85d424b14bb6c0347aa4af3865a72a3b	common_voice_en_32248509.mp3	It is unclear if this car had anything to do with Hill.	2	0			England English	en	
edad0b3940194e23c9d402b752e8340513a02427a3ab889f673f43309499bc450e46716041fcf08ccc983afe02e9f32a85d424b14bb6c0347aa4af3865a72a3b	common_voice_en_32248512.mp3	It might just change the way you look at roleplaying mechanics for ever.	2	0			England English	en	
edad0b3940194e23c9d402b752e8340513a02427a3ab889f673f43309499bc450e46716041fcf08ccc983afe02e9f32a85d424b14bb6c0347aa4af3865a72a3b	common_voice_en_32248533.mp3	The tug was raised in February of the following year and returned to service.	4	0			England English	en	
edad0b3940194e23c9d402b752e8340513a02427a3ab889f673f43309499bc450e46716041fcf08ccc983afe02e9f32a85d424b14bb6c0347aa4af3865a72a3b	common_voice_en_32248534.mp3	The term used to described this shame is ""shonda"" (a Yiddish term).	2	0			England English	en	
edad0b3940194e23c9d402b752e8340513a02427a3ab889f673f43309499bc450e46716041fcf08ccc983afe02e9f32a85d424b14bb6c0347aa4af3865a72a3b	common_voice_en_32248536.mp3	The lower Xfinity and Camping World Truck Series were also added as support events.	6	0			England English	en	
edad0b3940194e23c9d402b752e8340513a02427a3ab889f673f43309499bc450e46716041fcf08ccc983afe02e9f32a85d424b14bb6c0347aa4af3865a72a3b	common_voice_en_32248545.mp3	Bompas took interest in astronomy and studied periodic meteor showers and the Zodiacal light.	2	0			England English	en	
edad0b3940194e23c9d402b752e8340513a02427a3ab889f673f43309499bc450e46716041fcf08ccc983afe02e9f32a85d424b14bb6c0347aa4af3865a72a3b	common_voice_en_32248546.mp3	She was the regent of this organization from its formation until her death.	2	0			England English	en	
edad0b3940194e23c9d402b752e8340513a02427a3ab889f673f43309499bc450e46716041fcf08ccc983afe02e9f32a85d424b14bb6c0347aa4af3865a72a3b	common_voice_en_32248551.mp3	Thor uses the blessing of Gaea to make the barren planet filled with life.	4	0			England English	en	
edad0b3940194e23c9d402b752e8340513a02427a3ab889f673f43309499bc450e46716041fcf08ccc983afe02e9f32a85d424b14bb6c0347aa4af3865a72a3b	common_voice_en_32248552.mp3	The final was contested by Uruguayan club Nacional and Argentine side River Plate.	4	0			England English	en	
edad0b3940194e23c9d402b752e8340513a02427a3ab889f673f43309499bc450e46716041fcf08ccc983afe02e9f32a85d424b14bb6c0347aa4af3865a72a3b	common_voice_en_32248554.mp3	He acted in the areas of Popoli and Verno.	4	0			England English	en	
edad0b3940194e23c9d402b752e8340513a02427a3ab889f673f43309499bc450e46716041fcf08ccc983afe02e9f32a85d424b14bb6c0347aa4af3865a72a3b	common_voice_en_32248555.mp3	He received an Amnesty International award for his work regarding sexual violence against men.	4	2			England English	en	
edad0b3940194e23c9d402b752e8340513a02427a3ab889f673f43309499bc450e46716041fcf08ccc983afe02e9f32a85d424b14bb6c0347aa4af3865a72a3b	common_voice_en_32248556.mp3	This was in recognition of his achievements in the field of sports.	2	0			England English	en	
edad0b3940194e23c9d402b752e8340513a02427a3ab889f673f43309499bc450e46716041fcf08ccc983afe02e9f32a85d424b14bb6c0347aa4af3865a72a3b	common_voice_en_32248557.mp3	The top two teams from each group will advance to the semifinals.	4	0			England English	en	
