client_id	path	sentence	up_votes	down_votes	age	gender	accents	locale	segment
1744cff9d33b70420c7e5517881e81ec4bab1ac475e3b8a679a9a6fbd46953075741df42b0c6c0b80d66dc72c01297c3cc55e5e5fc7f53e84a435bf555987863	common_voice_en_32199324.mp3	The following were the members for Hastings.	2	0			United States English	en	
1744cff9d33b70420c7e5517881e81ec4bab1ac475e3b8a679a9a6fbd46953075741df42b0c6c0b80d66dc72c01297c3cc55e5e5fc7f53e84a435bf555987863	common_voice_en_32199331.mp3	In the afternoon the Prussian troops withdrew from the occupied positions as ordered.	2	0			United States English	en	
1744cff9d33b70420c7e5517881e81ec4bab1ac475e3b8a679a9a6fbd46953075741df42b0c6c0b80d66dc72c01297c3cc55e5e5fc7f53e84a435bf555987863	common_voice_en_32199358.mp3	Wang went to school in New Mexico and Nevada.	2	0			United States English	en	
1744cff9d33b70420c7e5517881e81ec4bab1ac475e3b8a679a9a6fbd46953075741df42b0c6c0b80d66dc72c01297c3cc55e5e5fc7f53e84a435bf555987863	common_voice_en_32199373.mp3	John and Lydia Swift.	2	0			United States English	en	
1744cff9d33b70420c7e5517881e81ec4bab1ac475e3b8a679a9a6fbd46953075741df42b0c6c0b80d66dc72c01297c3cc55e5e5fc7f53e84a435bf555987863	common_voice_en_32199376.mp3	She grew up in the township of Pleasant Point in rural south Canterbury.	2	0			United States English	en	
1744cff9d33b70420c7e5517881e81ec4bab1ac475e3b8a679a9a6fbd46953075741df42b0c6c0b80d66dc72c01297c3cc55e5e5fc7f53e84a435bf555987863	common_voice_en_32199378.mp3	The single flower is held noticeably above the leaf.	2	0			United States English	en	
1744cff9d33b70420c7e5517881e81ec4bab1ac475e3b8a679a9a6fbd46953075741df42b0c6c0b80d66dc72c01297c3cc55e5e5fc7f53e84a435bf555987863	common_voice_en_32199387.mp3	At times they lived outside Scotland and at times they lived apart.	2	0			United States English	en	
1744cff9d33b70420c7e5517881e81ec4bab1ac475e3b8a679a9a6fbd46953075741df42b0c6c0b80d66dc72c01297c3cc55e5e5fc7f53e84a435bf555987863	common_voice_en_32199388.mp3	Roger married Christiana.	4	0			United States English	en	
1744cff9d33b70420c7e5517881e81ec4bab1ac475e3b8a679a9a6fbd46953075741df42b0c6c0b80d66dc72c01297c3cc55e5e5fc7f53e84a435bf555987863	common_voice_en_32199389.mp3	These sculptures are on display in Swat Museum.	2	0			United States English	en	
1744cff9d33b70420c7e5517881e81ec4bab1ac475e3b8a679a9a6fbd46953075741df42b0c6c0b80d66dc72c01297c3cc55e5e5fc7f53e84a435bf555987863	common_voice_en_32199402.mp3	The springs are located between two forks of the Candelaria fault.	2	0			United States English	en	
1744cff9d33b70420c7e5517881e81ec4bab1ac475e3b8a679a9a6fbd46953075741df42b0c6c0b80d66dc72c01297c3cc55e5e5fc7f53e84a435bf555987863	common_voice_en_32199428.mp3	He served on the local school.	2	0			United States English	en	
1744cff9d33b70420c7e5517881e81ec4bab1ac475e3b8a679a9a6fbd46953075741df42b0c6c0b80d66dc72c01297c3cc55e5e5fc7f53e84a435bf555987863	common_voice_en_32199510.mp3	It’s about the difference between state media and the fourth estate.	2	0			United States English	en	
1744cff9d33b70420c7e5517881e81ec4bab1ac475e3b8a679a9a6fbd46953075741df42b0c6c0b80d66dc72c01297c3cc55e5e5fc7f53e84a435bf555987863	common_voice_en_32199512.mp3	After his death an updated edition was written by Bob James.	2	0			United States English	en	
1744cff9d33b70420c7e5517881e81ec4bab1ac475e3b8a679a9a6fbd46953075741df42b0c6c0b80d66dc72c01297c3cc55e5e5fc7f53e84a435bf555987863	common_voice_en_32199534.mp3	Hawkins married four times.	2	0			United States English	en	
1744cff9d33b70420c7e5517881e81ec4bab1ac475e3b8a679a9a6fbd46953075741df42b0c6c0b80d66dc72c01297c3cc55e5e5fc7f53e84a435bf555987863	common_voice_en_32199567.mp3	Nothing in it says we should take souls.	4	0			United States English	en	
1744cff9d33b70420c7e5517881e81ec4bab1ac475e3b8a679a9a6fbd46953075741df42b0c6c0b80d66dc72c01297c3cc55e5e5fc7f53e84a435bf555987863	common_voice_en_32199569.mp3	Ten medal events were contested.	2	0			United States English	en	
1744cff9d33b70420c7e5517881e81ec4bab1ac475e3b8a679a9a6fbd46953075741df42b0c6c0b80d66dc72c01297c3cc55e5e5fc7f53e84a435bf555987863	common_voice_en_32199571.mp3	John Ernst was the team captain.	4	0			United States English	en	
1744cff9d33b70420c7e5517881e81ec4bab1ac475e3b8a679a9a6fbd46953075741df42b0c6c0b80d66dc72c01297c3cc55e5e5fc7f53e84a435bf555987863	common_voice_en_32199600.mp3	Boggs Mountain was named after him.	4	0			United States English	en	
1744cff9d33b70420c7e5517881e81ec4bab1ac475e3b8a679a9a6fbd46953075741df42b0c6c0b80d66dc72c01297c3cc55e5e5fc7f53e84a435bf555987863	common_voice_en_32199602.mp3	Prabhu Solomon wanted to bring the issue of elephant abuse to the light.	2	0			United States English	en	
1744cff9d33b70420c7e5517881e81ec4bab1ac475e3b8a679a9a6fbd46953075741df42b0c6c0b80d66dc72c01297c3cc55e5e5fc7f53e84a435bf555987863	common_voice_en_32199625.mp3	Castillo also played one season on the Ladies Asian Golf Tour.	2	0			United States English	en	
1744cff9d33b70420c7e5517881e81ec4bab1ac475e3b8a679a9a6fbd46953075741df42b0c6c0b80d66dc72c01297c3cc55e5e5fc7f53e84a435bf555987863	common_voice_en_32199626.mp3	Asif Jalali graduated from Kabul Polytechnic University.	4	0			United States English	en	
1744cff9d33b70420c7e5517881e81ec4bab1ac475e3b8a679a9a6fbd46953075741df42b0c6c0b80d66dc72c01297c3cc55e5e5fc7f53e84a435bf555987863	common_voice_en_32199629.mp3	After two rounds he held the joint lead with Barry Vivian.	4	0			United States English	en	
1744cff9d33b70420c7e5517881e81ec4bab1ac475e3b8a679a9a6fbd46953075741df42b0c6c0b80d66dc72c01297c3cc55e5e5fc7f53e84a435bf555987863	common_voice_en_32199630.mp3	The fountain is located below the street level and is accessible by stairs.	2	0			United States English	en	
1744cff9d33b70420c7e5517881e81ec4bab1ac475e3b8a679a9a6fbd46953075741df42b0c6c0b80d66dc72c01297c3cc55e5e5fc7f53e84a435bf555987863	common_voice_en_32199639.mp3	Colonel Richard Mangrum.	2	0			United States English	en	
1744cff9d33b70420c7e5517881e81ec4bab1ac475e3b8a679a9a6fbd46953075741df42b0c6c0b80d66dc72c01297c3cc55e5e5fc7f53e84a435bf555987863	common_voice_en_32199671.mp3	Harvard tied for fifth place in the Ivy League.	4	0			United States English	en	
1744cff9d33b70420c7e5517881e81ec4bab1ac475e3b8a679a9a6fbd46953075741df42b0c6c0b80d66dc72c01297c3cc55e5e5fc7f53e84a435bf555987863	common_voice_en_32199672.mp3	She began playing the harpsichord at the age of five.	2	0			United States English	en	
1744cff9d33b70420c7e5517881e81ec4bab1ac475e3b8a679a9a6fbd46953075741df42b0c6c0b80d66dc72c01297c3cc55e5e5fc7f53e84a435bf555987863	common_voice_en_32199690.mp3	Williamsburg was in the census district south of Hunting Creek.	2	0			United States English	en	
1744cff9d33b70420c7e5517881e81ec4bab1ac475e3b8a679a9a6fbd46953075741df42b0c6c0b80d66dc72c01297c3cc55e5e5fc7f53e84a435bf555987863	common_voice_en_32199691.mp3	She was going to unload.	2	0			United States English	en	
1744cff9d33b70420c7e5517881e81ec4bab1ac475e3b8a679a9a6fbd46953075741df42b0c6c0b80d66dc72c01297c3cc55e5e5fc7f53e84a435bf555987863	common_voice_en_32233439.mp3	All tracks are produced by Dan Auerbach.	2	0	twenties	male	United States English	en	
1744cff9d33b70420c7e5517881e81ec4bab1ac475e3b8a679a9a6fbd46953075741df42b0c6c0b80d66dc72c01297c3cc55e5e5fc7f53e84a435bf555987863	common_voice_en_32233441.mp3	Goswami hails from Bandel in Hooghly district.	2	0	twenties	male	United States English	en	
1744cff9d33b70420c7e5517881e81ec4bab1ac475e3b8a679a9a6fbd46953075741df42b0c6c0b80d66dc72c01297c3cc55e5e5fc7f53e84a435bf555987863	common_voice_en_32233442.mp3	The competition was the first to feature separate junior and senior competitive divisions.	2	0	twenties	male	United States English	en	
1744cff9d33b70420c7e5517881e81ec4bab1ac475e3b8a679a9a6fbd46953075741df42b0c6c0b80d66dc72c01297c3cc55e5e5fc7f53e84a435bf555987863	common_voice_en_32233444.mp3	Sources differ on the total number of floors.	2	0	twenties	male	United States English	en	
1744cff9d33b70420c7e5517881e81ec4bab1ac475e3b8a679a9a6fbd46953075741df42b0c6c0b80d66dc72c01297c3cc55e5e5fc7f53e84a435bf555987863	common_voice_en_32233472.mp3	He was raised in New Jersey and attended Juilliard School for violin.	2	0	twenties	male	United States English	en	
1744cff9d33b70420c7e5517881e81ec4bab1ac475e3b8a679a9a6fbd46953075741df42b0c6c0b80d66dc72c01297c3cc55e5e5fc7f53e84a435bf555987863	common_voice_en_32233520.mp3	He was credited with the destruction of at least five enemy aircraft.	4	0	twenties	male	United States English	en	
1744cff9d33b70420c7e5517881e81ec4bab1ac475e3b8a679a9a6fbd46953075741df42b0c6c0b80d66dc72c01297c3cc55e5e5fc7f53e84a435bf555987863	common_voice_en_32233561.mp3	Marjorie’s work and documentation of Pakistani art made her popular guest at schools.	2	0	twenties	male	United States English	en	
1744cff9d33b70420c7e5517881e81ec4bab1ac475e3b8a679a9a6fbd46953075741df42b0c6c0b80d66dc72c01297c3cc55e5e5fc7f53e84a435bf555987863	common_voice_en_32233585.mp3	Pobeda is the nearest rural locality.	2	0	twenties	male	United States English	en	
1744cff9d33b70420c7e5517881e81ec4bab1ac475e3b8a679a9a6fbd46953075741df42b0c6c0b80d66dc72c01297c3cc55e5e5fc7f53e84a435bf555987863	common_voice_en_32233587.mp3	Gekko reassures her that her baby is just another job.	2	0	twenties	male	United States English	en	
1744cff9d33b70420c7e5517881e81ec4bab1ac475e3b8a679a9a6fbd46953075741df42b0c6c0b80d66dc72c01297c3cc55e5e5fc7f53e84a435bf555987863	common_voice_en_32233591.mp3	Residents fear losing their ties to the land.	4	0	twenties	male	United States English	en	
1744cff9d33b70420c7e5517881e81ec4bab1ac475e3b8a679a9a6fbd46953075741df42b0c6c0b80d66dc72c01297c3cc55e5e5fc7f53e84a435bf555987863	common_voice_en_32233627.mp3	His work extends from basic psychopathology to prevention and treatment.	2	0	twenties	male	United States English	en	
1744cff9d33b70420c7e5517881e81ec4bab1ac475e3b8a679a9a6fbd46953075741df42b0c6c0b80d66dc72c01297c3cc55e5e5fc7f53e84a435bf555987863	common_voice_en_32233629.mp3	He was succeeded in the baronetcy by his brother Bryan.	2	0	twenties	male	United States English	en	
1744cff9d33b70420c7e5517881e81ec4bab1ac475e3b8a679a9a6fbd46953075741df42b0c6c0b80d66dc72c01297c3cc55e5e5fc7f53e84a435bf555987863	common_voice_en_32233650.mp3	The texture of the thallus surface ranges from smooth to wrinkled.	2	0	twenties	male	United States English	en	
1744cff9d33b70420c7e5517881e81ec4bab1ac475e3b8a679a9a6fbd46953075741df42b0c6c0b80d66dc72c01297c3cc55e5e5fc7f53e84a435bf555987863	common_voice_en_32233682.mp3	It also notes it as The Stranglers first ever use of backing singers.	2	0	twenties	male	United States English	en	
1744cff9d33b70420c7e5517881e81ec4bab1ac475e3b8a679a9a6fbd46953075741df42b0c6c0b80d66dc72c01297c3cc55e5e5fc7f53e84a435bf555987863	common_voice_en_32233684.mp3	Sand flies also require sugar from plants as their energy source.	2	0	twenties	male	United States English	en	
1744cff9d33b70420c7e5517881e81ec4bab1ac475e3b8a679a9a6fbd46953075741df42b0c6c0b80d66dc72c01297c3cc55e5e5fc7f53e84a435bf555987863	common_voice_en_32233715.mp3	The competition was contested by thirteen clubs.	4	0	twenties	male	United States English	en	
1744cff9d33b70420c7e5517881e81ec4bab1ac475e3b8a679a9a6fbd46953075741df42b0c6c0b80d66dc72c01297c3cc55e5e5fc7f53e84a435bf555987863	common_voice_en_32233716.mp3	They also sealed up the temple on this site.	2	0	twenties	male	United States English	en	
1744cff9d33b70420c7e5517881e81ec4bab1ac475e3b8a679a9a6fbd46953075741df42b0c6c0b80d66dc72c01297c3cc55e5e5fc7f53e84a435bf555987863	common_voice_en_32233719.mp3	The stupa starts to round off only above these three tiers.	2	0	twenties	male	United States English	en	
1744cff9d33b70420c7e5517881e81ec4bab1ac475e3b8a679a9a6fbd46953075741df42b0c6c0b80d66dc72c01297c3cc55e5e5fc7f53e84a435bf555987863	common_voice_en_32233762.mp3	The school is part of the Herefordshire Marches Federation of Academies.	2	0	twenties	male	United States English	en	
1744cff9d33b70420c7e5517881e81ec4bab1ac475e3b8a679a9a6fbd46953075741df42b0c6c0b80d66dc72c01297c3cc55e5e5fc7f53e84a435bf555987863	common_voice_en_32233764.mp3	She also continued to attend Church of Scotland services where she could Holy Communion.	2	0	twenties	male	United States English	en	
1744cff9d33b70420c7e5517881e81ec4bab1ac475e3b8a679a9a6fbd46953075741df42b0c6c0b80d66dc72c01297c3cc55e5e5fc7f53e84a435bf555987863	common_voice_en_32233775.mp3	He requested advice on "weak powder" from the Laird of Roslin.	2	0	twenties	male	United States English	en	
1744cff9d33b70420c7e5517881e81ec4bab1ac475e3b8a679a9a6fbd46953075741df42b0c6c0b80d66dc72c01297c3cc55e5e5fc7f53e84a435bf555987863	common_voice_en_32233831.mp3	Morrison played baseball and football at Everett High School.	2	0	twenties	male	United States English	en	
1744cff9d33b70420c7e5517881e81ec4bab1ac475e3b8a679a9a6fbd46953075741df42b0c6c0b80d66dc72c01297c3cc55e5e5fc7f53e84a435bf555987863	common_voice_en_32233846.mp3	Jamil is the Chairman of Singer Bangladesh.	2	0	twenties	male	United States English	en	
1744cff9d33b70420c7e5517881e81ec4bab1ac475e3b8a679a9a6fbd46953075741df42b0c6c0b80d66dc72c01297c3cc55e5e5fc7f53e84a435bf555987863	common_voice_en_32233884.mp3	It is the largest mixed use development project undertaken in Sri Lanka.	2	0	twenties	male	United States English	en	
1744cff9d33b70420c7e5517881e81ec4bab1ac475e3b8a679a9a6fbd46953075741df42b0c6c0b80d66dc72c01297c3cc55e5e5fc7f53e84a435bf555987863	common_voice_en_32233900.mp3	The controversy made state and national headlines.	2	0	twenties	male	United States English	en	
1744cff9d33b70420c7e5517881e81ec4bab1ac475e3b8a679a9a6fbd46953075741df42b0c6c0b80d66dc72c01297c3cc55e5e5fc7f53e84a435bf555987863	common_voice_en_32233902.mp3	There is no objection whatsoever from us.	2	0	twenties	male	United States English	en	
1744cff9d33b70420c7e5517881e81ec4bab1ac475e3b8a679a9a6fbd46953075741df42b0c6c0b80d66dc72c01297c3cc55e5e5fc7f53e84a435bf555987863	common_voice_en_32233903.mp3	He was the first African American elected to the council.	2	0	twenties	male	United States English	en	
1744cff9d33b70420c7e5517881e81ec4bab1ac475e3b8a679a9a6fbd46953075741df42b0c6c0b80d66dc72c01297c3cc55e5e5fc7f53e84a435bf555987863	common_voice_en_32233930.mp3	From semifinal the best four athletes qualifies to the final.	4	0	twenties	male	United States English	en	
1744cff9d33b70420c7e5517881e81ec4bab1ac475e3b8a679a9a6fbd46953075741df42b0c6c0b80d66dc72c01297c3cc55e5e5fc7f53e84a435bf555987863	common_voice_en_32233931.mp3	Scaife was an employment lawyer prior to entering politics.	2	0	twenties	male	United States English	en	
1744cff9d33b70420c7e5517881e81ec4bab1ac475e3b8a679a9a6fbd46953075741df42b0c6c0b80d66dc72c01297c3cc55e5e5fc7f53e84a435bf555987863	common_voice_en_32233932.mp3	Most of his family curls.	2	0	twenties	male	United States English	en	
1744cff9d33b70420c7e5517881e81ec4bab1ac475e3b8a679a9a6fbd46953075741df42b0c6c0b80d66dc72c01297c3cc55e5e5fc7f53e84a435bf555987863	common_voice_en_32234034.mp3	The music for the film was composed by Hesham Abdul Wahab.	2	0	twenties	male	United States English	en	
1744cff9d33b70420c7e5517881e81ec4bab1ac475e3b8a679a9a6fbd46953075741df42b0c6c0b80d66dc72c01297c3cc55e5e5fc7f53e84a435bf555987863	common_voice_en_32234060.mp3	It also covers the Russian language.	2	0	twenties	male	United States English	en	
1744cff9d33b70420c7e5517881e81ec4bab1ac475e3b8a679a9a6fbd46953075741df42b0c6c0b80d66dc72c01297c3cc55e5e5fc7f53e84a435bf555987863	common_voice_en_32234072.mp3	Johnston played for Cambridge University and then Richmond.	2	0	twenties	male	United States English	en	
1744cff9d33b70420c7e5517881e81ec4bab1ac475e3b8a679a9a6fbd46953075741df42b0c6c0b80d66dc72c01297c3cc55e5e5fc7f53e84a435bf555987863	common_voice_en_32234075.mp3	It was painted in Antwerp.	2	0	twenties	male	United States English	en	
1744cff9d33b70420c7e5517881e81ec4bab1ac475e3b8a679a9a6fbd46953075741df42b0c6c0b80d66dc72c01297c3cc55e5e5fc7f53e84a435bf555987863	common_voice_en_32234116.mp3	Her mother is an architect and her father is an electrical engineer.	2	0	twenties	male	United States English	en	
1744cff9d33b70420c7e5517881e81ec4bab1ac475e3b8a679a9a6fbd46953075741df42b0c6c0b80d66dc72c01297c3cc55e5e5fc7f53e84a435bf555987863	common_voice_en_32234120.mp3	They would become the parents of two children.	4	0	twenties	male	United States English	en	
1744cff9d33b70420c7e5517881e81ec4bab1ac475e3b8a679a9a6fbd46953075741df42b0c6c0b80d66dc72c01297c3cc55e5e5fc7f53e84a435bf555987863	common_voice_en_32234272.mp3	She trained in internal medicine at Massachusetts General Hospital in Boston.	2	0	twenties	male	United States English	en	
1744cff9d33b70420c7e5517881e81ec4bab1ac475e3b8a679a9a6fbd46953075741df42b0c6c0b80d66dc72c01297c3cc55e5e5fc7f53e84a435bf555987863	common_voice_en_32234356.mp3	Bus services are provided by Transit Systems Sydney.	2	0	twenties	male	United States English	en	
1744cff9d33b70420c7e5517881e81ec4bab1ac475e3b8a679a9a6fbd46953075741df42b0c6c0b80d66dc72c01297c3cc55e5e5fc7f53e84a435bf555987863	common_voice_en_32234357.mp3	The election was nonpartisan.	2	0	twenties	male	United States English	en	
1744cff9d33b70420c7e5517881e81ec4bab1ac475e3b8a679a9a6fbd46953075741df42b0c6c0b80d66dc72c01297c3cc55e5e5fc7f53e84a435bf555987863	common_voice_en_32234359.mp3	Its surface elevation is above sea level.	4	0	twenties	male	United States English	en	
1744cff9d33b70420c7e5517881e81ec4bab1ac475e3b8a679a9a6fbd46953075741df42b0c6c0b80d66dc72c01297c3cc55e5e5fc7f53e84a435bf555987863	common_voice_en_32234380.mp3	The boats were full of men and were armed with guns.	2	0	twenties	male	United States English	en	
1744cff9d33b70420c7e5517881e81ec4bab1ac475e3b8a679a9a6fbd46953075741df42b0c6c0b80d66dc72c01297c3cc55e5e5fc7f53e84a435bf555987863	common_voice_en_32234382.mp3	Two organisations were involved in setting up this observer mission.	2	0	twenties	male	United States English	en	
1744cff9d33b70420c7e5517881e81ec4bab1ac475e3b8a679a9a6fbd46953075741df42b0c6c0b80d66dc72c01297c3cc55e5e5fc7f53e84a435bf555987863	common_voice_en_32234563.mp3	The bodywork was designed by order.	2	0	twenties	male	United States English	en	
1744cff9d33b70420c7e5517881e81ec4bab1ac475e3b8a679a9a6fbd46953075741df42b0c6c0b80d66dc72c01297c3cc55e5e5fc7f53e84a435bf555987863	common_voice_en_32234568.mp3	After these appearances she retired from the stage.	2	0	twenties	male	United States English	en	
1744cff9d33b70420c7e5517881e81ec4bab1ac475e3b8a679a9a6fbd46953075741df42b0c6c0b80d66dc72c01297c3cc55e5e5fc7f53e84a435bf555987863	common_voice_en_32234569.mp3	Her solo shows have often included Sidi playing many different characters.	2	0	twenties	male	United States English	en	
1744cff9d33b70420c7e5517881e81ec4bab1ac475e3b8a679a9a6fbd46953075741df42b0c6c0b80d66dc72c01297c3cc55e5e5fc7f53e84a435bf555987863	common_voice_en_32234570.mp3	The Gamecocks played their home games at Founders Park.	2	0	twenties	male	United States English	en	
1744cff9d33b70420c7e5517881e81ec4bab1ac475e3b8a679a9a6fbd46953075741df42b0c6c0b80d66dc72c01297c3cc55e5e5fc7f53e84a435bf555987863	common_voice_en_32234575.mp3	He then had the victim strangled.	4	0	twenties	male	United States English	en	
1744cff9d33b70420c7e5517881e81ec4bab1ac475e3b8a679a9a6fbd46953075741df42b0c6c0b80d66dc72c01297c3cc55e5e5fc7f53e84a435bf555987863	common_voice_en_32234578.mp3	He sat as Deputy Chairman of the Samara Provincial Duma.	2	0	twenties	male	United States English	en	
1744cff9d33b70420c7e5517881e81ec4bab1ac475e3b8a679a9a6fbd46953075741df42b0c6c0b80d66dc72c01297c3cc55e5e5fc7f53e84a435bf555987863	common_voice_en_32234600.mp3	Hieu has made significant and sustained contributions to research.	2	0	twenties	male	United States English	en	
1744cff9d33b70420c7e5517881e81ec4bab1ac475e3b8a679a9a6fbd46953075741df42b0c6c0b80d66dc72c01297c3cc55e5e5fc7f53e84a435bf555987863	common_voice_en_32234644.mp3	Bristol City were drawn away to Forest Green Rovers in the first round.	2	0	twenties	male	United States English	en	
1744cff9d33b70420c7e5517881e81ec4bab1ac475e3b8a679a9a6fbd46953075741df42b0c6c0b80d66dc72c01297c3cc55e5e5fc7f53e84a435bf555987863	common_voice_en_32234646.mp3	He was succeeded by Allen Thompson.	2	0	twenties	male	United States English	en	
1744cff9d33b70420c7e5517881e81ec4bab1ac475e3b8a679a9a6fbd46953075741df42b0c6c0b80d66dc72c01297c3cc55e5e5fc7f53e84a435bf555987863	common_voice_en_32234655.mp3	She seems to have had two reasons for keeping it.	2	0	twenties	male	United States English	en	
1744cff9d33b70420c7e5517881e81ec4bab1ac475e3b8a679a9a6fbd46953075741df42b0c6c0b80d66dc72c01297c3cc55e5e5fc7f53e84a435bf555987863	common_voice_en_32234686.mp3	The right main output doubles as mono output.	2	0	twenties	male	United States English	en	
1744cff9d33b70420c7e5517881e81ec4bab1ac475e3b8a679a9a6fbd46953075741df42b0c6c0b80d66dc72c01297c3cc55e5e5fc7f53e84a435bf555987863	common_voice_en_32234687.mp3	It has hosted the Scandinavian Enterprise Open on the European Tour.	2	0	twenties	male	United States English	en	
1744cff9d33b70420c7e5517881e81ec4bab1ac475e3b8a679a9a6fbd46953075741df42b0c6c0b80d66dc72c01297c3cc55e5e5fc7f53e84a435bf555987863	common_voice_en_32234709.mp3	The orders were then executed simultaneously by the computer.	2	0	twenties	male	United States English	en	
1744cff9d33b70420c7e5517881e81ec4bab1ac475e3b8a679a9a6fbd46953075741df42b0c6c0b80d66dc72c01297c3cc55e5e5fc7f53e84a435bf555987863	common_voice_en_32234742.mp3	The deities are dressed in new dresses and jewellery sets.	2	0	twenties	male	United States English	en	
1744cff9d33b70420c7e5517881e81ec4bab1ac475e3b8a679a9a6fbd46953075741df42b0c6c0b80d66dc72c01297c3cc55e5e5fc7f53e84a435bf555987863	common_voice_en_32234822.mp3	The undersides are pink with undertones of yellow.	2	0	twenties	male	United States English	en	
1744cff9d33b70420c7e5517881e81ec4bab1ac475e3b8a679a9a6fbd46953075741df42b0c6c0b80d66dc72c01297c3cc55e5e5fc7f53e84a435bf555987863	common_voice_en_32234903.mp3	Ge was born in China.	2	0	twenties	male	United States English	en	
1744cff9d33b70420c7e5517881e81ec4bab1ac475e3b8a679a9a6fbd46953075741df42b0c6c0b80d66dc72c01297c3cc55e5e5fc7f53e84a435bf555987863	common_voice_en_32234974.mp3	The foundation financially supports existing initiatives that contribute to achieving its mission.	2	0	twenties	male	United States English	en	
1744cff9d33b70420c7e5517881e81ec4bab1ac475e3b8a679a9a6fbd46953075741df42b0c6c0b80d66dc72c01297c3cc55e5e5fc7f53e84a435bf555987863	common_voice_en_32234976.mp3	Latimer served as the Mecosta County treasurer for three terms.	2	0	twenties	male	United States English	en	
1744cff9d33b70420c7e5517881e81ec4bab1ac475e3b8a679a9a6fbd46953075741df42b0c6c0b80d66dc72c01297c3cc55e5e5fc7f53e84a435bf555987863	common_voice_en_32235084.mp3	The team won the title again.	2	0	twenties	male	United States English	en	
1744cff9d33b70420c7e5517881e81ec4bab1ac475e3b8a679a9a6fbd46953075741df42b0c6c0b80d66dc72c01297c3cc55e5e5fc7f53e84a435bf555987863	common_voice_en_32235201.mp3	It blooms between June and July producing yellow flowers.	2	0	twenties	male	United States English	en	
1744cff9d33b70420c7e5517881e81ec4bab1ac475e3b8a679a9a6fbd46953075741df42b0c6c0b80d66dc72c01297c3cc55e5e5fc7f53e84a435bf555987863	common_voice_en_32235202.mp3	The pace of change increased when Great Britain became the Mandatory power in Palestine.	2	0	twenties	male	United States English	en	
1744cff9d33b70420c7e5517881e81ec4bab1ac475e3b8a679a9a6fbd46953075741df42b0c6c0b80d66dc72c01297c3cc55e5e5fc7f53e84a435bf555987863	common_voice_en_32235215.mp3	The case quickly gained widespread attention in the media.	2	0	twenties	male	United States English	en	
1744cff9d33b70420c7e5517881e81ec4bab1ac475e3b8a679a9a6fbd46953075741df42b0c6c0b80d66dc72c01297c3cc55e5e5fc7f53e84a435bf555987863	common_voice_en_32235275.mp3	Some of his works were published after his death.	4	0	twenties	male	United States English	en	
1744cff9d33b70420c7e5517881e81ec4bab1ac475e3b8a679a9a6fbd46953075741df42b0c6c0b80d66dc72c01297c3cc55e5e5fc7f53e84a435bf555987863	common_voice_en_32235915.mp3	Chicago architect Arthur Heun designed new buildings and landscaped the grounds.	4	0	twenties	male	United States English	en	
1744cff9d33b70420c7e5517881e81ec4bab1ac475e3b8a679a9a6fbd46953075741df42b0c6c0b80d66dc72c01297c3cc55e5e5fc7f53e84a435bf555987863	common_voice_en_32235918.mp3	He is the President of Kerala Film Chamber of Commerce.	2	0	twenties	male	United States English	en	
1744cff9d33b70420c7e5517881e81ec4bab1ac475e3b8a679a9a6fbd46953075741df42b0c6c0b80d66dc72c01297c3cc55e5e5fc7f53e84a435bf555987863	common_voice_en_32235944.mp3	The locality takes its name from the mountain.	2	0	twenties	male	United States English	en	
1744cff9d33b70420c7e5517881e81ec4bab1ac475e3b8a679a9a6fbd46953075741df42b0c6c0b80d66dc72c01297c3cc55e5e5fc7f53e84a435bf555987863	common_voice_en_32235948.mp3	His career was halted by the French revolution.	2	0	twenties	male	United States English	en	
1744cff9d33b70420c7e5517881e81ec4bab1ac475e3b8a679a9a6fbd46953075741df42b0c6c0b80d66dc72c01297c3cc55e5e5fc7f53e84a435bf555987863	common_voice_en_32235974.mp3	It is one of the smallest constituencies.	2	0	twenties	male	United States English	en	
1744cff9d33b70420c7e5517881e81ec4bab1ac475e3b8a679a9a6fbd46953075741df42b0c6c0b80d66dc72c01297c3cc55e5e5fc7f53e84a435bf555987863	common_voice_en_32236022.mp3	After her retirement from the stage she lived in Berg at Lake Starnberg.	2	0	twenties	male	United States English	en	
1744cff9d33b70420c7e5517881e81ec4bab1ac475e3b8a679a9a6fbd46953075741df42b0c6c0b80d66dc72c01297c3cc55e5e5fc7f53e84a435bf555987863	common_voice_en_32236070.mp3	She additionally held an acoustic performance in Tirana.	4	0	twenties	male	United States English	en	
1744cff9d33b70420c7e5517881e81ec4bab1ac475e3b8a679a9a6fbd46953075741df42b0c6c0b80d66dc72c01297c3cc55e5e5fc7f53e84a435bf555987863	common_voice_en_32236074.mp3	The manuscript is not to be confused with the Damascus Pentateuch.	2	0	twenties	male	United States English	en	
1744cff9d33b70420c7e5517881e81ec4bab1ac475e3b8a679a9a6fbd46953075741df42b0c6c0b80d66dc72c01297c3cc55e5e5fc7f53e84a435bf555987863	common_voice_en_32236088.mp3	He began his college basketball career at Wisconsin–Platteville.	2	0	twenties	male	United States English	en	
